{
  "version": 2,
  "task_id": "fixture-task",
  "handoff_id": "handoff-1",
  "operation_id": "fixture-task-review-1",
  "parent_handoff_id": null,
  "direction": "delegation",
  "status": "ready",
  "from_surface": "CHAT",
  "from_session_id": "chat-1",
  "recommended_surface": "CODEX",
  "target_session_id": "codex-1",
  "policy_version": "2026-09-19.1",
  "policy_sha256": "8d42985aad136a4344841611bacfce4ea8cbd371fc410b2af983447b6c88a904",
  "created_at": "2026-09-05T00:00:00Z",
  "goal": "Review the pinned example repository",
  "done": [
    "Repository identified"
  ],
  "remaining": [
    "Review the requested file"
  ],
  "repo": "bacoco/example",
  "branch": "main",
  "commit_sha": "aaaaaaaaaaaaaaaaaaaaaaaaaaaaaaaaaaaaaaaa",
  "files": [
    "src/example.py"
  ],
  "constraints": [
    "Read-only review"
  ],
  "actions": [
    {
      "action": "github.read",
      "resource": "bacoco/example"
    }
  ],
  "authorized_actions": [
    {
      "action": "github.read",
      "resource": "bacoco/example"
    }
  ],
  "authorization_ref": "fixture:explicit-user-authorization",
  "forbidden_surfaces": [],
  "cost_unit": "usd_micro",
  "estimated_cost_units": 100,
  "max_cost_units": 200,
  "evidence": [],
  "tests": [],
  "success_criteria": [
    "Requested review complete"
  ],
  "verification": [],
  "escalation_reason": "Destination has the required scoped repository capability",
  "return_to_chat_when": [
    "Re-evaluate destination access and remaining work"
  ],
  "extensions": {}
}
