{
  "version": 2,
  "task_id": "fixture-task",
  "handoff_id": "return-1",
  "operation_id": "fixture-task-review-1",
  "parent_handoff_id": "handoff-1",
  "direction": "return",
  "status": "completed",
  "from_surface": "CODEX",
  "from_session_id": "codex-1",
  "recommended_surface": "CHAT",
  "target_session_id": "chat-1",
  "policy_version": "2026-09-19.1",
  "policy_sha256": "8d42985aad136a4344841611bacfce4ea8cbd371fc410b2af983447b6c88a904",
  "created_at": "2026-09-05T00:30:00+00:00",
  "goal": "Review the pinned example repository",
  "done": [
    "Requested review complete"
  ],
  "remaining": [],
  "repo": "bacoco/example",
  "branch": "main",
  "commit_sha": "aaaaaaaaaaaaaaaaaaaaaaaaaaaaaaaaaaaaaaaa",
  "files": [
    "src/example.py"
  ],
  "constraints": [
    "Read-only review"
  ],
  "actions": [],
  "authorized_actions": [
    {
      "action": "github.read",
      "resource": "bacoco/example"
    }
  ],
  "authorization_ref": "fixture:explicit-user-authorization",
  "forbidden_surfaces": [],
  "cost_unit": "usd_micro",
  "estimated_cost_units": 0,
  "max_cost_units": 200,
  "evidence": [
    {
      "ref": "fixture:review-result",
      "description": "Synthetic review result",
      "observed_at": "2026-09-05T00:30:00Z",
      "commit_sha": "aaaaaaaaaaaaaaaaaaaaaaaaaaaaaaaaaaaaaaaa"
    }
  ],
  "tests": [],
  "success_criteria": [
    "Requested review complete"
  ],
  "verification": [
    {
      "criterion": "Requested review complete",
      "result": "pass",
      "evidence_ref": "fixture:review-result",
      "observed_at": "2026-09-05T00:30:00Z",
      "commit_sha": "aaaaaaaaaaaaaaaaaaaaaaaaaaaaaaaaaaaaaaaa"
    }
  ],
  "escalation_reason": "Specialist result; destination must re-evaluate remaining work",
  "return_to_chat_when": [
    "Re-evaluate destination access and remaining work"
  ],
  "extensions": {}
}
